{
  "corpus_id": "voisu-smart-writing-behavior-2026-08-09",
  "version": "3.1.0-approved",
  "issue": {
    "github_number": 99,
    "title": "Prototype the Smart and Literal writing behavior",
    "parent_map": 96,
    "url": "https://github.com/Anuraj-dev/voisu/issues/99"
  },
  "approval_state": "approved",
  "language": "en",
  "scope": {
    "in_scope": [
      "Exact English Smart vs Literal before/after examples for Raja approval",
      "Must-change and must-preserve counterexamples as full proposed strings",
      "Open product decisions with complete mutually exclusive alternatives",
      "Structured formatting_changes vs grammar_changes notes (human labels only)"
    ],
    "out_of_scope": [
      "Release scoring, thresholds, denominators, and CI pass/fail gates (#103 after approval)",
      "Machine safety validation, protected/forbidden matchers, lexical sequence evaluators (#100)",
      "Structured edit/patch representation and rejection policy (#100)",
      "Locked command parser/state-machine implementation contract (choose D_cmd first; implement in #103)",
      "HTML/UI prototypes, live ASR, Groq calls, Delivery paths"
    ]
  },
  "decisions": [
    {
      "id": "D_cmd",
      "title": "Command syntax strategy",
      "question": "How should explicit formatting commands be recognized in the Validated Transcript? This is a product choice; #99 does not lock a parser.",
      "status": "approved",
      "recommendation": "Prefer A (explicit introducer) for meaning safety; accept B only if Raja wants Wispr-like bare phrases and accepts noun-phrase ambiguity risk on counterexamples.",
      "blocks_fixture_ids": [
        "F09",
        "F09b",
        "F10",
        "F10b",
        "F11",
        "F12",
        "F13",
        "F13b",
        "F14",
        "F14b",
        "F15",
        "F15b",
        "F16",
        "F16b",
        "F21",
        "F21b",
        "F22",
        "F22b",
        "F36",
        "F36b",
        "F37",
        "F38",
        "F39",
        "F40",
        "F41",
        "F42"
      ],
      "options": [
        {
          "id": "D_cmd-A",
          "label": "Explicit introducer",
          "summary": "Only `command <phrase>` fires. Bare lexicon phrases are ordinary speech. `literal command <phrase>` escapes to spoken words without firing."
        },
        {
          "id": "D_cmd-B",
          "label": "Natural bare commands",
          "summary": "Bare phrases may fire as commands with an explicit literal escape for word-sense. Accepts documented ambiguity risk on noun phrases (bullet train, brand new line, etc.)."
        }
      ],
      "selected_option_id": "D_cmd-A"
    },
    {
      "id": "D1",
      "title": "Terminal punctuation after paragraph command",
      "question": "When a new paragraph command fires, should Smart add terminal periods on short multi-word fragments?",
      "status": "approved",
      "recommendation": "Yes for fragments with two or more content words.",
      "blocks_fixture_ids": [
        "F14",
        "F14b"
      ],
      "options": [
        {
          "id": "D1-A",
          "label": "Breaks only",
          "summary": "Emit paragraph break and case lines; no added periods."
        },
        {
          "id": "D1-B",
          "label": "Smart terminal punct",
          "summary": "Also add periods on multi-word fragments."
        }
      ],
      "selected_option_id": "D1-B"
    },
    {
      "id": "D3",
      "title": "List inference without list commands",
      "question": "May Smart infer bullets from a clearly list-like Validated Transcript without a spoken list command?",
      "status": "approved",
      "recommendation": "Approved: conservative transcript-content-aware inference; never application context. Ambiguous prose stays prose.",
      "blocks_fixture_ids": [
        "F17"
      ],
      "options": [
        {
          "id": "D3-A",
          "label": "No inference",
          "summary": "Prose commas only."
        },
        {
          "id": "D3-B",
          "label": "Infer bullets",
          "summary": "Allow Smart to infer list structure only when the Validated Transcript clearly expresses a list. Ambiguous prose stays prose; exact conservative gates belong to #100/#103."
        }
      ],
      "selected_option_id": "D3-B"
    },
    {
      "id": "D4",
      "title": "Capitalization inside quotes",
      "question": "When quote commands fire, may Smart sentence-case a full quoted sentence?",
      "status": "approved",
      "recommendation": "Preserve validated in-quote casing by default.",
      "blocks_fixture_ids": [
        "F21",
        "F21b"
      ],
      "options": [
        {
          "id": "D4-A",
          "label": "Preserve in-quote casing",
          "summary": "Outer clause only."
        },
        {
          "id": "D4-B",
          "label": "Sentence-case full quotes",
          "summary": "Also case inside full quoted sentences."
        }
      ],
      "selected_option_id": "D4-A"
    },
    {
      "id": "D5",
      "title": "Double negatives",
      "question": "Should Minimal Grammar standardize double negatives, or preserve spoken voice?",
      "status": "approved",
      "recommendation": "Preserve voice; only apostrophe/case.",
      "blocks_fixture_ids": [
        "F27"
      ],
      "options": [
        {
          "id": "D5-A",
          "label": "Preserve double negative",
          "summary": "I didn't see no error."
        },
        {
          "id": "D5-B",
          "label": "Standardize negation",
          "summary": "I didn't see any error."
        }
      ],
      "selected_option_id": "D5-A"
    },
    {
      "id": "D10",
      "title": "Email greeting structure",
      "question": "Should Smart invent a greeting line and blank line for hi <name> openings?",
      "status": "approved",
      "recommendation": "Approved: no special email-layout invention for v1; punctuate as a single paragraph.",
      "blocks_fixture_ids": [
        "F04"
      ],
      "options": [
        {
          "id": "D10-A",
          "label": "Structured email",
          "summary": "Greeting + blank line + body."
        },
        {
          "id": "D10-B",
          "label": "Single paragraph",
          "summary": "Punctuate without invented blank lines."
        }
      ],
      "selected_option_id": "D10-B"
    },
    {
      "id": "D14",
      "title": "Oxford comma",
      "question": "Prefer Oxford comma in Smart serial lists?",
      "status": "approved",
      "recommendation": "Prefer Oxford comma.",
      "blocks_fixture_ids": [
        "F18"
      ],
      "options": [
        {
          "id": "D14-A",
          "label": "Oxford comma",
          "summary": "a, b, and c"
        },
        {
          "id": "D14-B",
          "label": "No Oxford comma",
          "summary": "a, b and c"
        }
      ],
      "selected_option_id": "D14-A"
    }
  ],
  "fixtures": [
    {
      "id": "F01",
      "status": "locked",
      "category": "casual",
      "roles": [
        "must_change",
        "mode_delta"
      ],
      "input": "hey can you send the notes when you get a chance",
      "expected": {
        "literal": "hey can you send the notes when you get a chance",
        "smart": "Hey, can you send the notes when you get a chance?"
      },
      "formatting_changes": [
        "sentence case on first word",
        "comma after Hey",
        "terminal question mark"
      ],
      "grammar_changes": [],
      "rationale": "Casual must-change: Smart formats only. Meaning is the full proposed strings (not a substring gate)."
    },
    {
      "id": "F02",
      "status": "locked",
      "category": "casual",
      "roles": [
        "must_preserve",
        "mode_delta"
      ],
      "input": "gonna ping you later ok",
      "expected": {
        "literal": "gonna ping you later ok",
        "smart": "Gonna ping you later, ok?"
      },
      "formatting_changes": [
        "sentence case",
        "comma before ok",
        "terminal question mark"
      ],
      "grammar_changes": [],
      "rationale": "Must-preserve slang: Smart may punctuate/case; must not expand gonna→going to (see exact Smart string)."
    },
    {
      "id": "F03",
      "status": "locked",
      "category": "casual",
      "roles": [
        "must_preserve",
        "mode_delta"
      ],
      "input": "so um I think we should ship friday",
      "expected": {
        "literal": "so um I think we should ship friday",
        "smart": "So um I think we should ship Friday."
      },
      "formatting_changes": [
        "sentence case",
        "weekday capitalization Friday",
        "terminal period"
      ],
      "grammar_changes": [],
      "rationale": "Must-preserve fillers um/so; no filler deletion (contrast Wispr-like cleanup)."
    },
    {
      "id": "F05",
      "status": "locked",
      "category": "email",
      "roles": [
        "must_change",
        "mode_delta"
      ],
      "input": "please let me know if that timeline works",
      "expected": {
        "literal": "please let me know if that timeline works",
        "smart": "Please let me know if that timeline works."
      },
      "formatting_changes": [
        "sentence case",
        "terminal period"
      ],
      "grammar_changes": [],
      "rationale": "No invented email sign-off chrome; exact Smart string has no Best regards/Sincerely."
    },
    {
      "id": "F06",
      "status": "locked",
      "category": "technical",
      "roles": [
        "must_preserve",
        "mode_delta"
      ],
      "input": "the endpoint returns 404 when the correlation_id is missing",
      "expected": {
        "literal": "the endpoint returns 404 when the correlation_id is missing",
        "smart": "The endpoint returns 404 when the correlation_id is missing."
      },
      "formatting_changes": [
        "sentence case",
        "terminal period"
      ],
      "grammar_changes": [],